{
  "$schema": "http://json-schema.org/draft-07/schema#",
  "$id": "https://github.com/tjpinder/intake-kit/schema/turn.schema.json",
  "title": "Intake turn (schema_version 1)",
  "description": "What the model returns every turn. Written to the strict structured-output subset shared by Azure OpenAI and the Claude API: every property required, additionalProperties false, nullable fields as type unions, no dynamic keys, no pattern/length/count keywords. Rules this subset can't express (ID formats, band names, quote grounding, one probe per area) are enforced by apply-turn against scoring.yaml and the transcript. There is deliberately no field for scores, composites, quadrants or gates.",
  "type": "object",
  "additionalProperties": false,
  "required": ["reply", "updates", "facts", "router", "prose", "acceptance", "guardrails", "open_questions", "reflect_back", "next_target"],
  "properties": {
    "reply": {
      "type": "string",
      "description": "The next thing said to the user: one question, or the reflect-back."
    },
    "updates": {
      "type": "array",
      "description": "Coverage changes heard this turn.",
      "items": { "$ref": "#/$defs/update" }
    },
    "facts": {
      "type": "array",
      "description": "Band picks for scoring criteria, AI overlay checks, adoption and gate facts. The model picks a band name; code maps it to a score via scoring.yaml.",
      "items": { "$ref": "#/$defs/fact" }
    },
    "router": { "$ref": "#/$defs/router" },
    "prose": {
      "type": "array",
      "description": "Prose the spec pack needs that isn't a single coverage answer. Captured into the session file before rendering.",
      "items": { "$ref": "#/$defs/prose" }
    },
    "acceptance": {
      "type": "array",
      "description": "Acceptance criteria and error cases in Given/When/Then form. Each cites the coverage IDs it rests on; code attaches the user's quote when rendering.",
      "items": { "$ref": "#/$defs/acceptance" }
    },
    "guardrails": {
      "type": "array",
      "description": "Guardrail statements drawn from what the user said about trust, data and risk. Each cites the coverage IDs it rests on.",
      "items": { "$ref": "#/$defs/guardrail" }
    },
    "open_questions": {
      "type": "array",
      "items": { "$ref": "#/$defs/open_question" }
    },
    "reflect_back": {
      "description": "Null until the model is ready to reflect back. 'proposed' when presenting it; 'confirmed' or 'corrected' once the user has answered.",
      "anyOf": [{ "$ref": "#/$defs/reflect_back" }, { "type": "null" }]
    },
    "next_target": { "$ref": "#/$defs/next_target" }
  },
  "$defs": {
    "update": {
      "type": "object",
      "additionalProperties": false,
      "required": ["item", "area", "status", "value", "quote"],
      "properties": {
        "item": { "type": ["string", "null"], "description": "Item ID, or null for a shared-core area." },
        "area": { "type": "string", "description": "Namespaced coverage ID, e.g. core.users, data_report.grain, mod.integration.payload." },
        "status": { "type": "string", "enum": ["covered", "assumed", "unknown", "not_applicable"] },
        "value": { "type": ["string", "null"], "description": "Summary in plain words. Null when status is unknown." },
        "quote": { "type": ["string", "null"], "description": "The user's exact words supporting this update. Required for covered and assumed." }
      }
    },
    "fact": {
      "type": "object",
      "additionalProperties": false,
      "required": ["item", "fact", "band", "evidence", "quote"],
      "properties": {
        "item": { "type": "string" },
        "fact": {
          "type": "string",
          "enum": [
            "rule_clarity", "input_digital", "input_structured", "ways_done", "stability", "documentation", "steps_apps", "access", "value",
            "ai_applies", "eval_ability", "error_cost", "human_review", "simpler_option", "fallback", "sensitive_data",
            "push", "pull", "anxiety", "habit",
            "existing_asset", "decision_depends", "broken_cause", "workaround_permanent", "success_metric"
          ]
        },
        "band": { "type": "string", "description": "One of the band names scoring.yaml defines for this fact." },
        "evidence": { "type": "array", "items": { "type": "string" }, "description": "Coverage IDs the band was derived from." },
        "quote": { "type": ["string", "null"], "description": "The user's words behind the band, when there is one." }
      }
    },
    "router": {
      "type": "object",
      "additionalProperties": false,
      "required": ["new_items", "reclassify", "add_modifiers", "remove_modifiers", "supersede", "drop"],
      "properties": {
        "new_items": { "type": "array", "items": { "$ref": "#/$defs/new_item" } },
        "reclassify": { "anyOf": [{ "$ref": "#/$defs/reclassify" }, { "type": "null" }] },
        "add_modifiers": { "type": "array", "items": { "$ref": "#/$defs/add_modifier" } },
        "remove_modifiers": { "type": "array", "items": { "$ref": "#/$defs/remove_modifier" } },
        "supersede": { "anyOf": [{ "$ref": "#/$defs/supersede" }, { "type": "null" }] },
        "drop": { "anyOf": [{ "$ref": "#/$defs/drop" }, { "type": "null" }] }
      }
    },
    "new_item": {
      "type": "object",
      "additionalProperties": false,
      "required": ["id", "type", "confidence", "title", "trigger_quote", "spawned_from"],
      "properties": {
        "id": { "type": "string" },
        "type": { "$ref": "#/$defs/item_type" },
        "confidence": { "type": "string", "enum": ["high", "med", "low"] },
        "title": { "type": "string" },
        "trigger_quote": { "type": "string" },
        "spawned_from": { "type": ["string", "null"] }
      }
    },
    "reclassify": {
      "type": "object",
      "additionalProperties": false,
      "required": ["item", "to", "reason", "quote"],
      "properties": {
        "item": { "type": "string" },
        "to": { "$ref": "#/$defs/item_type" },
        "reason": { "type": "string" },
        "quote": { "type": "string" }
      }
    },
    "add_modifier": {
      "type": "object",
      "additionalProperties": false,
      "required": ["item", "modifier", "quote"],
      "properties": {
        "item": { "type": "string" },
        "modifier": { "type": "string", "enum": ["integration", "compliance", "migration"] },
        "quote": { "type": "string" }
      }
    },
    "remove_modifier": {
      "type": "object",
      "additionalProperties": false,
      "required": ["item", "modifier", "reason"],
      "properties": {
        "item": { "type": "string" },
        "modifier": { "type": "string", "enum": ["integration", "compliance", "migration"] },
        "reason": { "type": "string", "description": "Why it doesn't apply, e.g. the user said there's no API." }
      }
    },
    "drop": {
      "type": "object",
      "additionalProperties": false,
      "required": ["item", "reason", "quote"],
      "properties": {
        "item": { "type": "string", "description": "An item that turned out not to apply. Not for an item the new one replaces: that's supersede." },
        "reason": { "type": "string" },
        "quote": { "type": "string", "description": "The user's words saying it doesn't apply." }
      }
    },
    "supersede": {
      "type": "object",
      "additionalProperties": false,
      "required": ["item", "by", "quote"],
      "properties": {
        "item": { "type": "string", "description": "The item that would be replaced." },
        "by": { "type": "string", "description": "The item that replaces it if it reaches Go." },
        "quote": { "type": "string" }
      }
    },
    "prose": {
      "type": "object",
      "additionalProperties": false,
      "required": ["item", "field", "text"],
      "properties": {
        "item": { "type": ["string", "null"] },
        "field": { "type": "string", "enum": ["problem_statement", "current_state", "mvp", "out_of_scope", "mitigation"] },
        "text": { "type": "string" }
      }
    },
    "acceptance": {
      "type": "object",
      "additionalProperties": false,
      "required": ["item", "kind", "given", "when", "then", "evidence"],
      "properties": {
        "item": { "type": "string" },
        "kind": { "type": "string", "enum": ["criterion", "error_case"] },
        "given": { "type": "string" },
        "when": { "type": "string" },
        "then": { "type": "string" },
        "evidence": { "type": "array", "items": { "type": "string" }, "description": "Coverage IDs with a recorded answer and quote." }
      }
    },
    "guardrail": {
      "type": "object",
      "additionalProperties": false,
      "required": ["item", "kind", "text", "evidence"],
      "properties": {
        "item": { "type": "string" },
        "kind": { "type": "string", "enum": ["kill_criterion", "fallback", "review_point", "data_rule"] },
        "text": { "type": "string" },
        "evidence": { "type": "array", "items": { "type": "string" } }
      }
    },
    "open_question": {
      "type": "object",
      "additionalProperties": false,
      "required": ["item", "area", "question", "who_can_answer", "artifact_needed"],
      "properties": {
        "item": { "type": ["string", "null"] },
        "area": { "type": "string" },
        "question": { "type": "string" },
        "who_can_answer": { "type": ["string", "null"] },
        "artifact_needed": { "type": ["string", "null"] }
      }
    },
    "reflect_back": {
      "type": "object",
      "additionalProperties": false,
      "required": ["text", "status", "corrections"],
      "properties": {
        "text": { "type": "string" },
        "status": { "type": "string", "enum": ["proposed", "confirmed", "corrected"] },
        "corrections": { "type": "array", "items": { "type": "string" } }
      }
    },
    "next_target": {
      "type": "object",
      "additionalProperties": false,
      "required": ["item", "area", "is_probe"],
      "properties": {
        "item": { "type": ["string", "null"] },
        "area": { "type": ["string", "null"], "description": "The coverage ID the reply asks about, or null for the reflect-back." },
        "is_probe": { "type": "boolean", "description": "True when the reply re-asks an area the user already answered vaguely. apply-turn allows one probe per area." }
      }
    },
    "item_type": { "type": "string", "enum": ["broken", "manual_process", "known_idea", "exploratory", "data_report"] }
  }
}
