{
  "reply": "Got it. When you count a short pick, what's in and what's out?",
  "updates": [
    {
      "item": "item-1",
      "area": "data_report.grain",
      "status": "covered",
      "value": "Per picker, per shift, daily",
      "quote": "filter by shift and count by picker"
    },
    {
      "item": null,
      "area": "core.users",
      "status": "covered",
      "value": "Ops supervisor builds it; shift leads use it",
      "quote": "I build it, the shift leads use it Tuesday"
    }
  ],
  "facts": [],
  "router": {
    "new_items": [
      {
        "id": "item-2",
        "type": "manual_process",
        "confidence": "med",
        "title": "Monday Excel exception summary",
        "trigger_quote": "I build it in Excel every Monday",
        "spawned_from": "item-1"
      }
    ],
    "reclassify": null,
    "add_modifiers": [],
    "remove_modifiers": [],
    "supersede": null,
    "drop": null
  },
  "prose": [],
  "acceptance": [],
  "guardrails": [],
  "open_questions": [],
  "reflect_back": null,
  "next_target": {
    "item": "item-1",
    "area": "data_report.definition",
    "is_probe": false
  }
}
